<?xml version="1.0" encoding="UTF-8"?>
<xs:schema xmlns:xs="http://www.w3.org/2001/XMLSchema" elementFormDefault="qualified">
    <xs:element name="logkamar">
        <xs:complexType>
            <xs:sequence>
                <xs:element maxOccurs="unbounded" ref="kamar"/>
            </xs:sequence>
        </xs:complexType>
    </xs:element>
    <xs:element name="kamar">
        <xs:complexType>
            <xs:sequence>
                <xs:element ref="kode" minOccurs="1"/>
                <xs:element ref="nama"/>
                <xs:element ref="harga"/>
                <xs:element ref="fasilitas"/>
            </xs:sequence>
        </xs:complexType>
    </xs:element>
    <xs:element name="kode" type="xs:NCName"/>
    <xs:element name="nama" type="xs:string"/>
    <xs:element name="harga" type="xs:integer"/>
    <xs:element name="fasilitas">
        <xs:complexType>
            <xs:sequence>
                <xs:choice>
                    <xs:element ref="Jenis"/>
                    <xs:element ref="jenis"/>
                </xs:choice>
                <xs:element ref="no"/>
            </xs:sequence>
        </xs:complexType>
    </xs:element>
    <xs:element name="Jenis" type="xs:NCName"/>
    <xs:element name="jenis" type="xs:string"/>
    <xs:element name="no" type="xs:integer"/>
</xs:schema>
